Title,Author,Comment Count,Time,Article Content,Images In Article,URL
i made a dress out of target bags by Ellie F. '28,N/A,0,"September 21, 2025","Home Blogs i made a dress out of target bags by Ellie F. '28 i also edited a video about it September 21, 2025 in Blog Projects, Personal Projects, Summer Hey yall. It’s been a while. On Sunday June 21st I texted Ceri that I was planning on dropping an effortpost “in the next week or so”. (: It has now been over two weeks now since Silksong dropped. I have no explanation, only excuses. When I started this project I had big dreams, but now I have big psets. For the past two Tuesdays, the 10pm-11pm time slot on my Google Calendar has been blocked out to finish my Target blog and it didn’t happen either of those times. I feel like I have no time at all or maybe negative time but I still somehow have this stubborn belief that I can do big fun things that contribute nothing towards my to-do list. Life finds a way, I guess. Anyways here’s the vlog <3 https://youtu.be/M-zuz_nZhGY Details: I filmed this with my phone, balanced precariously on the edges of various boxes and tables. I edited it in Adobe Premiere Pro which I get free with my tuition. Most of the voiceover was recorded in one take, somehow. I got most of the bags from the Target in Central Square, as well as one or two from Alpha Delta Phi’s reusable bag rack. All of the sewing supplies were from MAD, with the exception of the red thread I was hand-sewing with, which I pilfered from Math Prize for Girls 2024. Shout out to Tor’s Cabinet of Curiosities, which I watched a lot of while sewing. One day I’m gonna get rich and make my own better version of the Georgia Guidestones. Thank you to Ceri for believing in me always. Thank you to Trader Joe’s which was three minutes from my house and supplied me all the snacks I needed to get through this. And thank you to the Academy. See you next effortpost. Post Tagged #sewing #summer #vlogs Share this post Share on Twitter Share on Reddit Share on Facebook Share by Email Subscribe to the RSS Feed Please enable JavaScript to view the comments powered by Disqus. About Ellie F. '28 Hi! I’m Ellie, class of 2028 :D I hail from Arkansas, land of Walmart and the trigonometric inverse of Kansas, but at MIT, I live in Simmons, where I have an aggressively curvy wall and only 18 windows. I’m currently majoring in indecision, but if that doesn’t work out, I’m also interested in cou… Keep Reading An arrow pointing right More from Ellie F. '28 [Guest Post] This is Junior Lab, not Junior Theory By Jorian B. '25 been walking a lot recently furthermore, i like taking pictures [Joint Post] DesignPlus A super cool and awesome first-year learning community ft. Gloria and Teresa (we're not biased) Answer these 13 questions and we’ll reveal the perfect dorm for you! What does your favorite dorm animal say about where you should live? Scootah Hockey a sport of tradition, friendship, and raw athleticism View All An arrow pointing right",1,https://mitadmissions.org/blogs/entry/i-made-a-dress-out-of-target-bags/
i became british for a summer by Anika H. '26,N/A,0,"September 18, 2025","Home Blogs i became british for a summer by Anika H. '26 featuring an internship at bristol robotics lab September 18, 2025 in Uncategorized I worked in Bristol Robotics this summer through MISTI, MIT’s travel abroad program. I figured this could be fun, getting to work somewhere cool and also play tourist on the weekend in another country, but even the internship alone was by far the best work/research experience I’ve had. I met wonderful people that I’m still friends with and was genuinely excited about the research enough that I continued working on it (at least for now before I get hosed) after the internship ended. Over the summer, we made a human-hand-sized robotic hand with touch sensing. cool people! Part of what I liked so much about the job was that I got to see and help with so many other projects and assistive tech. One grad student was working on a robot that could perform manual labor tasks, and I helped her paint an imaginary wall for half an hour as she collected data on arm movements. Jebby helped with a group designing a smart walker with crash detection and voice activation. I think Maddie, the other MISTI student from my group, got the coolest gig of walking around in a space suit with a pneumatic exoskeleton as they logged movement data. maddie wearing the spacesuit and walking on a treadmill Dr. Nathan Lepora, professor of robotics and master of bowling. He took the group out to Roxy Lanes and got food after :) An arrow pointing right Previous An arrow pointing right Next I worked in the Dextrous Robotics group. My direct supervisor was technically Nathan, but because his schedule was packed so full it practically overflowed, we only saw him once or twice a week when we had group meetings. When he was here though, he would ask so many good questions it made up for him never being around. He seems to be popular around the lab (there are 3D prints of his head on some desks). When I had questions, I usually went to annoy Chris. He had his own projects to work on so I tried not to bother him too much, but when I inevitably needed clarification on something, he would pause mid-task to help me unless he was in the middle of a meeting. Our group didn’t usually hang out during lunch, so when I saw Jebby with a bunch of people on her first day at work, I went “ooh, new friends!” And snuck my way into their group under the pretense of also wanting to help do the daily crossword puzzles. the usual suspects at lunch When I first met them, I did the very American thing of “Hi! My name is Anika and here are all my hobbies and interests” from force of habit, despite the MISTI culture training sessions. I also tried to stop myself from yapping too much, though that eventually got easier as I had slightly less to say after the first month or so. :| One of the best parts of the internship were all the people here, who were all effortlessly cool, funny, well traveled, or insanely cracked at the research they do, or some combination of all of these things. Unlike the US, there’s no social pressure to talk in the UK. You can just vibe with the group and they’ll be totally fine with just having your presence around, but the more I hung around, the more I wanted to get to know them better. Fortunately for me, they didn’t seem to mind if I talked either (until I got comfortable enough to pull out my terrible terrible British accent). cool people We went out to the pub together a few times to hang out and get drinks. We yapped about stupid things for 4 hours straight, and raved about the hot nuts they sold. You could get a cup full of “spicy” crunchy peanuts for 2.50 pounds and it was worth every pence. Right before our internships ended, Yash, Jebby, and I went to see Superman together and walked around the city until late in the night. By the end of the summer, I made some incredible friends. Incoming Nerd Dump!!!!! electronics Because I was the one electrical engineer out of three other mechanical engineers working on the project, I got the really fun task of designing the fingertip and electronics that were meant to fit inside it. The main challenge was that everything had to fit into less than 4 cubic centimeters. This meant that the circuit ended up being the easy part and the layout was an absolute pain. Between the USB-C port, an FPC connector for the camera, another one for the LEDs, and the smallest ESP32 I could find (an ESP32-S3-PICO), I crammed it onto a two layer PCB that I couldn’t physically shrink any more than I already had. teeny little board While initially thought it was a great idea because everything fit neatly on the back of the fingertip, it soon came back to bite me in the behind when I realized I had to solder everything on by hand. If we ordered the board preassembled, I would have left before it even arrived, leaving no time to test it, which meant we ordered the parts and the PCB separately. I thought I was good at PCB assembly before I experienced the pain of having to nudge ten ",22,https://mitadmissions.org/blogs/entry/i-became-british-for-a-summer/
My First Few Weeks at MIT by Hala K. '29,N/A,0,"September 22, 2025","Home Blogs My First Few Weeks at MIT by Hala K. '29 … one year ago September 22, 2025 in Prepare for MIT Every freshman’s first few weeks at MIT tend to follow a predictable pattern – hunting for the best shortcuts across campus, making daily trips to Newbury, creating long notes lists of all the restaurants you want to try, wandering through the underground tunnels, spending WAY too much time in Stud 5,⁠01 Fifth floor of the Stratton Student Center (commonly referred to as the Stud) learning to share a tiny room with 1-3 “strangers,” and stopping through Killian Court just to stare at the Great Dome, still in disbelief that you’re actually here. Over the past 3 weeks, I’ve found myself doing all of these – but now, with a sense of deja vu. Cue the best 6 weeks of my life: MITES. First, the “important” stuff: MITES Summer is an on-campus summer program at MIT for rising high school seniors. During the program, students take five college-level courses, receive college admissions and financial aid advice, and receive mentorship from current undergraduate students. Now, the important stuff: When I first got my acceptance to the program – I was super intimidated for a lot of reasons. Growing up as the youngest of four, with a dad who insisted I kept a fire extinguisher handy just for boiling water, I never considered myself the most self-reliant person. The idea of packing my things to live alone across the country? Terrifying. According to thousands of Reddit posts, MITES is insanely hard to survive. So basically, I signed up for a summer of stress, sleep deprivation, and failure. Fun. IT’S MIT. As new fears kept piling on, I started “being realistic”: I should just reject my acceptance. There was no way I belonged at this program, let alone at MIT. But after getting a lecture (or ten) from friends and family, I came to my senses. “It’s only six weeks. I can power through.” Spoiler alert: I was wrong. I didn’t just power through MITES, I absolutely fell in love with it. I remember stepping out of my Uber with no idea where New House⁠02 One of MIT’s 11 residence halls was, my suitcase barely zipped shut, and sweat already dripping down my face. But the second I walked in, someone called me by name, grabbed the other end of my suitcase, and said, “Welcome to MITES!” The next six weeks flew by. And I don’t know exactly when it happened – maybe somewhere between crying over physics, memorizing the structures for every amino acid (still proud of that), and late-night Dave’s Hot Chicken runs – but by the end, I had found a second family. And while I can’t fit six weeks of stories into one blog post, I can tell you a few that made me fall in love with the program, and with MIT. Engineering Design Each MITES student takes one “project course” – a hands-on STEM class that runs throughout the summer and ends with a final project. The options included Genomics, Machine Learning, Engineering Design, Architecture, and Embedded Systems. After going back and forth between Machine Learning and Engineering Design for what felt like forever, I decided to try something new and take Engineering Design. Best. Decision. Ever. The class started with designing a competitive “game,” then splitting into teams to build a robot that could win it. And at the end of the six weeks, there was a huge competition that the entire MITES community came to watch. For our cohort, we created a game where robots had to remove tennis balls from an elevated platform and score them into a zone on the opposite side of the board. After three weeks of hard work, my group finally completed our robot and not to brag, but it was really good. However, there was one major problem: it was too wide. Technically, it could get through the obstacles but it took a painfully long time. So, it’s 9 PM the night before the competition, and we’re all sitting there knowing our robot has potential… but probably wouldn’t make it far. After an hour of testing, debating, testing again, and spiraling a little, we made a reckless decision that no one else supported: we were going to cut three inches off the robot. That meant taking apart every width-related piece, cutting it down, and rebuilding everything… in two hours. It was chaotic, exhausting, and honestly one of the funnest nights I’ve ever had. And while everyone thought the robot that had once been a shoo-in for the win was doomed… the clock struck midnight and bippity boppity boo, WE DID IT! So, without further ado, let me introduce you to the one and only: The Weedkiller Close-up of our robot (before we shortened it) Post-victory photo with my TA, Jan, at the official competition. An arrow pointing right Previous An arrow pointing right Next And if it wasn’t already clear from the pride radiating off this blog – the Weedkiller won the whole tournament! Though even if we hadn’t won, my opinion of this class wouldn’t change one bit. From learning how to use the machines in the shop, to meeting the incredible people at th",6,https://mitadmissions.org/blogs/entry/my-first-few-weeks-at-mit/
I LOVE TATTE💖💖💖 by Aiden H. '28,N/A,0,"August 30, 2025","Home Blogs I LOVE TATTE💖💖💖 by Aiden H. '28 back in boston baby August 30, 2025 in How to Food A Love Letter to Tatte August 30th, 2025 Dearest Tatte, It has been an awfully long while since I’ve graced upon your tiled floors, and I know that you could only be awaiting (all of) my money to support your fine establishment. Yet I return with the greatest of news–I have arrived! After so many hot summer nights in Colorado reminiscing on your shakshuka, dreaming of your labneh, thirsting after your pistachio croissants, I run into your doors like it’s the first time, ogling at your immense pastry selection and chic decorations. It is easy to feel lost in the sea that is Boston cuisine (bars),⁠01 I'm reading this out loud to myself and I'm like 92% sure this rhymes but if not then statement redacted but even with so many options to choose (don’t get me started on our mutual enemy: Flour Cafe.), I of course come straight to you! In fact, I sat down with a new menu item (spinach, corn, and egg plate) just this morning, grinning like child in a candy shop. me looking greasy asf in tatte just this morning! (shoutout mom for getting the worst angle!) An arrow pointing right Previous An arrow pointing right Next Although my visit was cut short to direct my mother to the airport, do not fret at the sight of me leaving! It will only be a very short matter of time before I see you again, grabbing an afternoon pick-me-up between my new classes⁠02 new classes blog coming??? or deciding to get out of my dorm⁠03 new room tour blog coming??? between psets for a much needed comfort meal. Here’s to a new year! xoxo, aiden I'm reading this out loud to myself and I'm like 92% sure this rhymes but if not then statement redacted⁠ back to text ↑ new classes blog coming???⁠ back to text ↑ new room tour blog coming???⁠ back to text ↑ Share this post Share on Twitter Share on Reddit Share on Facebook Share by Email Subscribe to the RSS Feed Please enable JavaScript to view the comments powered by Disqus. About Aiden H. '28 Hey y’all! I’m Aiden, a ‘28 currently living in the newly renovated East Campus who’s planning on (but not entirely committing to) course 10B (Chemical-Biological Engineering). I was born in southern Missouri but grew up in northern Colorado, and before you can ask: no, I have never been skiing! … Keep Reading An arrow pointing right More from Aiden H. '28 cookies life lessons through six scrumptious sayings getting back in the groove 🎵groovy groovy🎵 first time in cdmx and first time out of the US, but not the first time having an ethnicity… my hottest STEM takes actively starting internet wars To ASE Or Not To ASE preparing academically for freshman year View All An arrow pointing right",5,https://mitadmissions.org/blogs/entry/i-love-tatte%f0%9f%92%96%f0%9f%92%96%f0%9f%92%96/
an infinite nine year old by Caleb M. '27,N/A,0,"September 23, 2025","Home Blogs an infinite nine year old by Caleb M. '27 and the infinite nineteen year old he became September 23, 2025 in Uncategorized The first time I walked down that hallway, the world was white. Many years later, I’d learn that that hallway was actually a ‘corridor’—an infinite one, at that. Dramatically, slash if I were into telling fables, I would say something like “I’d also come to learn that the world was white because of something called ‘snow.’” That would, however, be the most false thing I’ve ever said, because I obviously knew what snow was and had seen it multiple times before the day of this story. I was nine and grew up in Texas. It had snowed before. Anyway. The first time I walked down that infinite corridor, I was nine years old. My parents had always believed that one of the most important things that you could do was travel—to see the world and peek into the experiences of people beyond the metaphysical walls of Sachse, Texas, where I’d grown up. They had immigrated from Ethiopia to the United States a few years before I was born, so their entire life since then had been one loooong trip away from home. Yet they made the best of it, and throughout my childhood they took my older sibling Raiye and I on a vast array of adventures across the United States and occasionally across the ocean to Europe and, eventually, back home to Ethiopia. One of my oldest memories is asking my parents to bring me back the real Thomas the Tank Engine when they took Raiye to Kentucky when I was 3 and I stayed home with my grandmother. Suffice to say, they did NOT bring me back the real Thomas the Tank Engine. I’m also not confident why I thought he was in Kentucky. Nonetheless… I’ve been surrounded by travel all my life. The winter break of 4th grade, my dad—who had just got a new job as a professor at a college in Dallas—had a conference in a city far north from our humble Texan suburbs: Boston, Massachusetts. So the four of us packed our bags (I think I was still young enough to share a suitcase with Raiye, who was at the time 11), hopped on an airplane, and took what I didn’t know would be the first of many flights between DFW and BOS. We spent a couple days exploring the city, visiting the common, and doing the regular Boston tourist things. everybody say “aww.” “aww!” And then, one day, we visited two old buildings. Which isn’t shocking for Boston, but these two buildings (or groups of buildings, to be more specific) were quite special. The first one was a green field-of-sorts surrounded by tall, red brick buildings on every side. Tall gates surrounded the complex, and stepping through felt like leaving the city street surrounding it into a whole new little world. I remember walking through the grass and looking at the trees, hearing a name that I knew well—Harvard. There was crimson all about, and the sun shone on the greenery of the Yard. Students and tourists alike roamed about, and the entire scene felt rather idyllic, a brief portal into a world of red bricks and a million sidewalk paths spearing across the greenery. The second one was a little less frilled with fanfare. I remember entering through a door surrounded by a bunch of columns, and there aren’t many columns in Texas so I can actually say this was probably one of the few times I’d seen pillars that imposing. The weather had turned and it wasn’t as warm anymore, and there were no huge stretches of green around this part of town. If my memory serves, it was pretty dimly lit, fairly empty. I remember it feeling very brownish-green, in that deep patina’d-bronze way. I remember a long hallway that seemed to go on and on. I remember seeing a million posters for everything under the sun covering every square inch of both walls as we continued down the scarcely populated hallway. This one might be completely bull, but I distinctly remember a poster that looked like a Target logo with red and blue rings further down the way. Then, I remember the hallway opening into a larger lobby area. There were three big doors, and outside of those three big doors, a huge field was open for exploration and play. And what made that huge field so amenable to play? Snow. Now. I did mention earlier that I had absolutely seen snow before because I was not three. That being said, however, I had never seen snow like this. Snow in Texas doesn’t fall too heavy, doesn’t stick, and doesn’t let you do much with it. This? This was real, authentic, New England snow, deep enough to sink in and wet enough to build with. And that, I will admit, was pretty new. I remember as the posters and hallway slipped off my mind as Raiye and I rushed, hand-in-hand, through those giant doors and past even bigger columns and out onto the heavy layer of cloudy pillow that sprawled over the entire lawn. I remember grabbing fistfuls of it, throwing it at my sibling and giggling as I ran away from the ensuing counterattack, biting into it, building a little “fort” as well as a nine year old and a",4,https://mitadmissions.org/blogs/entry/an-infinite-nine-year-old/
