Title,Author,Comment Count,Time,Article Content,Images In Article,URL
[Guest Post] Rediscovering en Plein Air Painting by Allison E. '27,N/A,0,"September 17, 2025","Home Blogs [Guest Post] Rediscovering en Plein Air Painting by Allison E. '27 by Elisa X. '26, MEng '26 September 17, 2025 in Art, Literature, Music, MIT Life, Personal Projects, Projects, Summer View all This post is written by the wonderful Elisa X. ’26 / MEng ’26! Since I started college, my go-to fun fact when introducing myself is that I enjoy painting & drawing. As the semesters passed at MIT, this fun fact started feeling disingenuous as I strayed further and further away from this hobby. Now as I am starting my fourth year at MIT as a dual senior and MEng student,⁠01 Essentially, I am starting my MEng in EECS while completing a few leftover undergrad requirements. I still plan to graduate with my undergrad degree with the rest of my class in Spring 2026 then with my MEng in Fall 2026. only my closest friends really knew I painted in the past, mostly due to the occasional random conversation about art. In fact, funnily enough, I didn’t know my entire friend group had their own side interests in art (digital art, comic design, watercolor, sculpture, etc.) until over a year after we first met. At MIT, my aim was to maximize my experience. I told myself to expand my horizons and get out of my comfort zone. Over the past three years at MIT, I chased all sorts of side adventures, determined to make the most of my time: co-hosting a radio program, teaching biology in Italy, organizing logistics for MIT Science Olympiad, sailing on the Charles, and even helping a friend with an early-stage startup.⁠02 Crazily, he later dropped out, and his re-imagined startup just raised Series A! Along the way, I formed core memories too, like spontaneously road-tripping to Vermont for a total solar eclipse⁠03 The Great North American Eclipse on April 8th, 2024! and attending the world figure skating championships in Boston. While I do not regret doing any of this exploration, in the midst of all these new experiences, I side-tracked away from that comfort zone I once had. The most I did to reconnect with my artistic side was a half-semester Chinese calligraphy course I crammed into my schedule last semester. Ironically, despite my busy workload then, it was one of the classes I dedicated the most time to (due to how relaxing and fun it was), and my skills improved exponentially. My First Voyage into en Plein Air Painting I am very fortunate to have taken numerous art classes growing up with supportive teachers who nurtured my budding skills. Although I learned how to use most 2-D art mediums, my favorite was always paints, particularly acrylic due to its versatility in layering and fast drying time. During the beginning of the pandemic in my sophomore year of high school, I would frequently get bored lying around the house all day—so I started taking my full acrylic setup outdoors to paint en plein air,⁠04 <em>En plein air</em>, or the practice of creating art outdoors, was popularized by the 19th century impressionists like Claude Monet due to the new widespread availability of portable oil paint tubes. or in open air in French. Afternoon along the Chattahoochee River. Acrylic on canvas, 2020. Site of one of my first en plein air paintings along the Chattahoochee River near my home in GA. An arrow pointing right Previous An arrow pointing right Next The process of en plein air was quite different from how I approached crafting art pieces in the studio. For these artworks, I would thoroughly plan a compelling narrative along with the composition and colors—then spend dozens of hours refining even the smallest details. For my first few en plein air paintings, I strived to convey the scene perfectly, unable to finish the piece in one sitting. Eventually, with more and more practice, I learned to let go and just capture the essence of the moment. How I Rediscovered en Plein Air Painting After years of limited painting, the hardest part was accumulating the activation energy to get started again. Thanks to my summer internship, I finally had something that was quite foreign to an MIT student during the school year: work-life balance. Suddenly, I had so much extra time that I didn’t know what to do with it. I started off mindlessly scrolling on my phone then decided I wanted to do something more meaningful with my time, particularly away from the screen. My CS internship already involved me staring at a screen for hours on end. So on a random evening after work in August, I spontaneously busted out my old watercolor kit from layers of packed storage bags and wandered to the Charles River along Harvard to paint the sunset from life. Sunset over the CharlesWatercolor, gouache & pen on paper, 2025 En plein air painting was such a stark contrast from my MIT experience. At MIT, I was always in a rush; I self-identify as a meticulous planner, trying to anticipate my next steps months and even years in advance. With en plein air painting, I couldn’t anticipate my next stroke, let alone predict what the final piece would look like. My",12,https://mitadmissions.org/blogs/entry/guest-post-rediscovering-en-plein-air-painting/
Time dilation by Taylor L. '29,N/A,0,"September 23, 2025","Home Blogs Time dilation by Taylor L. '29 to the Infinite, and beyond September 23, 2025 in Uncategorized Every roommate I’ve lived with quickly discovers my hidden superpower: I am invulnerable to alarms in the morning, no matter how loud or obnoxious. If I wake up, it’s not because of a clock, but instead purely through the strength of hopes, dreams, affirmations, and prayers. Accordingly, my Kryptonite is waking up super early (before 11am). I don’t even want to admit how many first period tardies I had in my senior year of high school. Suffice to say, punctuality has never been my strong suit. My saving grace for the past few weeks has been MIT time. Every class starts five minutes after its posted time and ends five minutes before (ex: a 9am class begins at 9:05 and ends at 9:55). In theory, this is supposed to give you a ten-minute buffer if you have consecutive classes. Do I have any consecutive classes? No. Am I riding the coattails of everybody who has to sprint from Sloan ⁠01 business school to the end of the Infinite ⁠02 long (~1/6th of a mile) hallway that cuts through the main academic building twice a week? Of course I am. I’ve been in 8.01 (Physics: Classical Mechanics) for two weeks now (and I haven’t been late at all, thanks to MIT time). Like most things here, the class moves quickly. But out of everything I’ve learned so far, the idea of reference frames has especially stuck with me: things look different depending on your perspective. Taken to its extreme, reference frames lead to a phenomenon called time dilation, in which, paradoxically, time passes slower the faster that you’re moving (thanks Einstein!). I couldn’t explain the math behind it to you yet, but I can definitely say that stepping into MIT feels like stepping into a physics problem on time dilation. It’s very easy to feel windswept here. I’ve started to use Google Calendar for the first time, and now there’s a ton of colorful rectangles demanding I be at this place, at this time, to do this certain thing. It’s a rewarding type of busyness ⁠03 I like Google’s definition of busyness: 'the state or condition of having a great deal to do' and I’ve never learned so much in such a short time before, but it nonetheless requires an adjustment to a faster-paced day. There’s still a ton of small little breaks in the continuum here, though: physics assignments are due at 11:00 instead of 11:59 so I stress out at 10:59 instead and can spend the next hour relaxing, and I stand in a very long line to get stir fry at New Vassar during lunch, and I get ten minutes between classes to take a nice stroll through the Outfinite ⁠04 the outdoor counterpart of the Infinite to enjoy the not-cold Boston weather while it lasts. It’s in those moments of stillness where I feel super time-dilated, where I stop and think for a second and look back at how much has passed in what seems like an instant. I spent this past summer soaking in the last dregs of my hometown before leaving it to see the rest of the whole wide world, and those three months spent in my comfort zone feel just as packed as my first month at MIT. Every moment has been so full. I’m still in that awkward middle phase where my poorly-decorated room and my walk to class and the new friends I’ve met all feel familiar one second and foreign the next. I do wonder, sometimes, how long I have before the weather gets colder, the novelties wear off, and it all becomes business as usual. It’s nice to have that Gcal, then, as some sort of structure, a map to follow in case I remember that I moved away from the only home I’ve had in my eighteen years. But some of my fondest memories so far have been made outside of those colorful rectangles. It’s the simple, slow, or spontaneous things, like watching Sunday football on the third floor of Maseeh (go Panthers!), or the weekly The Summer I Turned Pretty ⁠05 all good things must come to an end, which is why there’s still a movie on the way debrief in the lounge right outside my door, or even waking up to the sun shining through my window on days where my first class is a 10(:05)am. I shouldn’t have to mention that time moves fast here, but it also moves slow, and I’ve found that the whitespaces of my calendar are just as full as the little colorful blocks. business school⁠ back to text ↑ long (~1/6th of a mile) hallway that cuts through the main academic building⁠ back to text ↑ I like Google’s definition of busyness: 'the state or condition of having a great deal to do⁠ back to text ↑ the outdoor counterpart of the Infinite⁠ back to text ↑ ⁠ back to text ↑ Share this post Share on Twitter Share on Reddit Share on Facebook Share by Email Subscribe to the RSS Feed Please enable JavaScript to view the comments powered by Disqus. About Taylor L. '29 Hi! I’m Taylor, a current freshman from Winston-Salem, North Carolina. The first Krispy Kreme was founded there, so getting coffee from Dunkin’ in the student center feels like an act of donut-shop treason. I’",1,https://mitadmissions.org/blogs/entry/time-dilation/
"[Guest Post] This is Junior Lab, not Junior Theory by Ellie F. '28",N/A,0,"September 1, 2025","Home Blogs [Guest Post] This is Junior Lab, not Junior Theory by Ellie F. '28 By Jorian B. '25 September 1, 2025 in Classes 8.13, or as it is more commonly known, Junior Lab or JLab, is the first experimental class in the “standard” 8 path. Most 8s take it Junior Fall⁠01 hence the Junior in the name after >=3 semesters of theory classes. The first few weeks (the Intro Period) are spent ensuring everyone has a common base of experimental skills. Practically, this means many small tasks in areas such as programming, statistics, LaTeX, and electronic equipment. You then do an “intro” experiment, either the Photoelectric Effect or Michelson Interferometry, which is a test-run for the workflow of a “full” experiment. For the intro experiment, there are only 3 hours of data collection (as opposed to the normal 15 hours) but you still give a full 15-minute presentation and write a 4-page paper. These are graded for completion! The format is hard the first time, but much easier the second so this is your chance to do paper and with no consequences if you miss the mark. The comments from your professor and your first practice will then make your first graded assignments go much smoother. Then, you choose two “full” experiments to work on for 5 lab sessions and write an associated paper + presentation (I did Johnson and shot noise and 21 cm radio astrophysics, two amazing experiments 10/10 I absolutely recommend). Everyone designs their own 3rd experiment using a pair of CosmicWatches, which measure muon flux. At the end, you polish your favorite presentation and give it in front of the whole class (not just the professor and TA) and any other people who might drop in. Look at how much stuff is packed into the first three weeks. It is literally ⅓ of the calendar 😭 JLab has a bad reputation. It is a class that people hear about before they even declare physics. Some common phrases to describe it are “stressful,” “time sink,” “frustrating,” and “draining.” For some of us though, JLab is one of the best classes in the physics curriculum. I’m here to tell you why this class is amazing. In the intro period, there is a discussion regarding what constitutes a good lab notebook.⁠02 because physicists should maintain one There are several funny things in the sample notebooks⁠03 including a gif of an owl swimming but this is my favorite part. First of all, every day is calibration day. Secondly, the phrase “I love electromagnets”⁠04 a very understandable sentiment has three words in it. ‘I’ has one letter in it. Sean⁠05 the fearless leader of the lab staff mispelled every word in that sentence, and I crack up every time I see this. Even your instructors make typos :) This series of comments does kind of encompass JLab: mistakes, funny moments, and experimental physics. JLab was the first place I felt I 100% belonged in physics. Coming into JLab, I was under the impression that most physicists were theorists. I didn’t think I was a “real” physics major because I liked hands-on work. As an engineering double major (in Course 16, AeroAstro), I cared about building things, testing, and troubleshooting. As far as I saw, physics majors cared about math, creating thought experiments⁠06 which are exactly what they sound like; you imagine an experiment and then do the math , and the innate beauty of equations. I thought my interest in physics was that of an enthusiastic amateur but that I didn’t have the “right personality” to be a physicist. Enter JLab. For the first time in 8, I saw myself in my instructors. My professor, TAs, and the lab staff were excited about hands-on work. They talked about real, imperfect systems, not idealized equations. Answers to my questions were grounded in observables. The weird effects from the design of each specific apparatus were considered important, not details to be brushed off because they’re not “fundamental.” One of my friends once described 8.06⁠07 Quantum Mechanics III as “systems aren’t in equilibrium and how to cope with that.” In a similar vein, JLab is “systems aren’t isolated and how to cope with that.” It had always bothered me that physics PSETS seemed contrived. In JLab suddenly my professors wanted to talk about all the extraneous effects besides the theory being studied. This was eye-opening: I misunderstood a huge portion of the profession. Experimental physics combined things I loved in both engineering and physics: it was hands-on and the driving question was “why” (whereas in engineering it is closer to “how”). Initially, I thought that they (the powers above in the physics department) had taken an engineering class and disguised it as a physics lab class because the activities in the intro period were so reminiscent of lab and design questions on my engineering PSETs. Engineering made JLab feel familiar.⁠08 But they are not equivalent. Experimental physics approaches engineering, just as theoretical physics approaches math. It was amazing to learn that physicists care about the ",14,https://mitadmissions.org/blogs/entry/guest-post-this-is-junior-lab-not-junior-theory/
New Year Resolutions in Fall by Richard O. '28,N/A,0,"August 31, 2025","Home Blogs New Year Resolutions in Fall by Richard O. '28 An ambitious list of things I wanna do that probably won't get done August 31, 2025 in Challenges, MIT Life With the school year coming back around, it only feels necessary to pretend it’s December 31st and start making a list of things I want to accomplish by the end of the school year knowing that 90% of the items on this list probably won’t get done anyways. So here are some things I wanna challenge myself with: Visit 15 new places to eat in the Cambridge/Boston area Learn the Ukulele with my roommate Learn to play my brother’s violin Learn 3 new coding languages 3D print something Use a sewing machine for something Build 3 new things in the makerspaces Travel abroad 3 times Finish all my Psets at least 2-3 days before the deadline (This might be very ambitious) Do 50% of my Psets off campus Finish a whole Pset in one sitting with no breaks Actually learn how to spell Massachusetts without double checking myself Go chairing in the tunnels Spend a day at the Cambridge Public Library Spend a day at the Boston Public Library Visit Harvard at least twice a semester Get a Harvard Library Card Go snowboarding again Finish Neal Shusterman’s Scythe Trilogy Keep my new fish alive (upcoming blog) Pull an all nighter in a lecture hall Sleep before midnight on most days of the week Don’t lose any of my stylus pens, headphones, glasses, or keys Spend a day photographing Boston Ride the full length of the Red Line Attend all the lectures for at least one class Watch 5 Studio Ghibli movies Watch Oppenheimer Catch up on One Piece? Finish a podcast series Write a short story Take the time to learn how to solve a Rubik’s Cube Take part in something advertised on Dormspam Attend a sporting event for another University Walk everywhere for a week instead of biking or using public transport Go a week without my headphones Go a day without using my phone, iPad, or laptop Watch the sun set and rise from the Green Building Take a day trip to New York Attend ring premiere and ring delivery Get my class ring Take a nap in the New House courtyard Take a nap by the river Take a nap on the Google rooftop garden Take a nap on Killian Court I’ll probably add to this list as ideas come up and will let you all know which of the maybe 3 things on this list I actually accomplish by the end of the school year. Share this post Share on Twitter Share on Reddit Share on Facebook Share by Email Subscribe to the RSS Feed Please enable JavaScript to view the comments powered by Disqus. About Richard O. '28 Hey Everyone! My name’s Richard Oti (or Richie if you want to feel like you know me well) and I’m a Ghanaian American from Virginia here at MIT taking on my freshman year. I’m currently a member of Chocolate City and planning to double major in course 6-14 (data science, computer science, and ec… Keep Reading An arrow pointing right More from Richard O. '28 Robots, Space, and the Stories In-Between Using Sci-Fi to Procrastinate Pictures From a Year of Classes The End of a Saga [Joint Post] Interviewing Two MIT Physics Heroes An Interview with Two MIT Physics Professors that are Departing from MIT. Thinking Outside of Absolutes A short thought piece on thinking about thinking Ebony Affair as a Pre-Frosh A Recap of my Experience from the 49th year of the Program View All An arrow pointing right",1,https://mitadmissions.org/blogs/entry/new-year-resolutions-in-fall/
picture the world by Boheng C. '28,N/A,0,"September 23, 2025","Home Blogs picture the world by Boheng C. '28 my phone's storage space hates me September 23, 2025 in Events, Miscellaneous, Personal Projects, Personal Travel i have taken two thousand, four hundred and forty photos since i came to MIT. my photo album conveniently lists them in chronological order, one after the other, in perfect linear narrative since i first stepped on campus. but i’ve found, increasingly, that memories don’t work that way. i’ve found that memories don’t often fall in orderly queues aligned with time; they meander and bifurcate and grow into each other. each place on campus and in boston — classrooms, dining halls, dorms, street intersections, parks — evoke moments in the past, or sometimes collections of moments spread over months at a time. thankfully for us, google photos not only displays its standard chronological view, but also lets you see where you took your photos, in the form of a heat map: 8 photos a day, for around three hundred days same map, but zoomed in on MIT (the big red cluster in the first picture) An arrow pointing right Previous An arrow pointing right Next each cluster on the map — bright red and orange — indicates a spot of high photo density and a clump of memories. here are some of the places that have the most memories: 1. massachusetts ave crossing outside lobby 7 like most students, i made the daily pilgrimage last year from my dorm in the west side of campus to my classes in the east side, and then back again in the afternoon. a pedestrian crossing across mass ave bridges the two sides — possibly the most iconic crossing on campus. november 7, 2024. the setting sun roughly aligns with the crossing and the infinite corridor in the days before and after mithenge december 11, 2024 december 24, 2024: my last few moments in boston for the fall semester, hauling a suitcase through fresh snow at 6 am january 20, 2025 An arrow pointing right Previous An arrow pointing right Next 2. 6.2000 lab the past semester, i took an intro lab in electrical engineering. sadly, i ditched most of the lectures and recitations⁠01 my bed was cozier , but i did try to make it to each lab session every friday afternoon. for a class that delayed the start of my weekend by three hours, it was incredibly fun and gratifying! we made a piano of light: a frequency-modulated laser morse code transmitter: and, of course, two op-amps passionately in love: 3. back side of simmons the front entrance of my dorm, simmons, faces vassar street. there isn’t much reason to go around the back side — it’s a thin sliver of lawn bordered by railroad tracks and populated by just a few lawn chairs. one december night, though, it started snowing. i hadn’t seen snow in years as a native of los angeles; from my tenth-floor window i saw the parking lot outside blanketed in miraculous soft white. at that moment, i was drafting my final linguistics essay with my friends alice ’27 and sovannjet ’27; we rushed down the elevator and out the back door and our faces were met with a rush of snowflakes in the air: my friends were sophomores then, so they had already experienced a boston winter and were well-acquainted with the sensation of ice on bare skin. but for me, it was tantalizingly novel; i gazed skyward and ran through the snow and gulped mouthfuls of ice from the air. i wanted to live this moment forever — forever and ever beneath windy sky and clouds and breaths of snow. when we finally went back upstairs, my friends noticed that my hair was full of glistening ice. 4. fourth-floor stata balcony last year, winterfest was held on december 10 in the stata center’s first-floor lobby. we lined up for hot chocolate and peppermint and gingerbread cookies. i got hot chocolate and waited for my friends to arrive so we could sit together. but after around fifteen minutes, they never came, so i searched for a place myself. eventually, i went outside in the freezing cold and sat on a plastic table on the fourth-floor of balcony of the stata building. it was foggy and dark and murkily silent and i could only see the ghostly outline of building 56 across the sea of fog from where i was sitting. but it was calm, and i sat there underneath the balcony lights and wrapped warmly in a puffer jacket, sipping hot chocolate with molten marshmallows and staring into the distance and sipping hot chocolate and staring. An arrow pointing right Previous An arrow pointing right Next i sat there for ten minutes, then twenty, until my last few sips of hot chocolate were already cold. it was uncomfortably chilly but i didn’t want to ever leave. i would come back to the balcony a few more times, once after i finished one of my fall finals and once during iap, but i never sat there for more than a few moments before i returned to the warmth inside. 5. charleston shipyard i visited boston with my family around two years ago, before i had any suspicion that i would one day be accepted to MIT. one november day, we walked along the freedom trail⁠",21,https://mitadmissions.org/blogs/entry/picture-the-world/
