Title,Author,Comment Count,Time,Article Content,Images In Article,URL
"Welcome our new bloggers! by Jenny B. '25, MEng '26",N/A,0,"September 16, 2025","Home Blogs Welcome our new bloggers! by Jenny B. '25, MEng '26 Huzzah! September 16, 2025 in Announcements After much deliberation over the 66 applications we received this summer, we are happy to announce our new bloggers! Please give a warm welcome to: Hala K. ‘29 from Michigan, who built not only robots but also endearing memories at MITES, and knows her best friends better than any online personality test out there. Taylor L. ‘29 from North Carolina, who went on a quest to find a Pink Lemonade Celsius near her hometown, and has much to tell you about the virtues of serif fonts in this day and age. Boheng C. ‘28 from California, who has biked all the way from campus to beaches and shipyards, and liveblogged from the depths of a freezing New England cave. Victor D. ‘27 from California, who cherishes the identities built into the squares and streets of Boston, and finds unfamiliar paths in familiar places to meet new friendly faces. (Hey, that rhymed!) Caleb M. ‘27 from Texas, whose first walk down the Infinite Corridor was during a snowy Boston haze, and loves bagels and sandwiches but HATES bagel sandwiches. They got some banger posts coming soon, so stay tuned! For those who didn’t get selected this time: thank you so much for taking the time and effort to apply. Writing for an audience takes a lot of vulnerability, courage, and mental energy. Also, as long as you’re an MIT undergrad then you can re-apply next summer! We hope that you continue sharing your story to the world, and we are excited to see what you will create. Share this post Share on Twitter Share on Reddit Share on Facebook Share by Email Subscribe to the RSS Feed Please enable JavaScript to view the comments powered by Disqus. About Jenny B. '25, MEng '26 Hey! People call me Jebby, or Jenny, or Jen. The bloggers call me Jebby. You can call me by any of these names. I was born in Atlanta (Go Braves!) and grew up in Montgomery, Alabama. I got my degree in 6-4: Artificial Intelligence and Decision Making in May 2025, and now I'm an MEng student. I r… Keep Reading An arrow pointing right More from Jenny B. '25, MEng '26 My design won an MIT merch contest I don't know why From East to West: An American’s Cross-Atlantic Voyage The start of my MISTI UK experience I graduated. i'll still be here for a year tho because i'm getting my master's ASK US (the MIT Bloggers) ANYTHING! YES [Announcement] The MIT Bloggers are hosting an AMA! Ask us anything this Friday and Saturday! View All An arrow pointing right",2,https://mitadmissions.org/blogs/entry/welcome-our-new-bloggers/
getting back in the groove by Aiden H. '28,N/A,0,"September 3, 2025","Home Blogs getting back in the groove by Aiden H. '28 🎵groovy groovy🎵 September 3, 2025 in Academics & Research, Classes, How to School Once upon a time in a land far, far away A group of schoolchildren gathered to recount their days. One says they cried, one says they laughed, but they all agreed in one very unfortunate path. That when the leaves fall down, sky turns blue to grey The freshman will forever cease to live in their PNR ways Instead learning the trials that come to all. Beware, the sophomore fall! *** Uh so yeah I’m gonna be a sophomore, and just saying that didn’t feel like dramatic enough of an opening. I wanted it to sound like an old nursery rhyme or something, but I also didn’t care that much so I wrote it in like 3 minutes.⁠01 WITHOUT rhyme zone or AI mind you. so like, speedy But anyway, people say sophomore year is the worst, but it’s also kinda the year class-wise, at least for 10B. You’re done with the GIRs and starting classes specifically for your major, but everyone in the major still has to take them, so the class sizes are still larger and the classes are well-known. Well funny enough (I planned it), this happens to be the first day of classes on campus, so I got an exclusive look into the so-called awful time everyone is having! This will be nothing too crazy, but it is for sure something I will want to look back on at the end of the semester to see if this excitement is just first-week delusion or the start of a new chapter in my MIT career (and feelings towards it). Here are the classes, in order of appearance: 5.07 – Introduction to Biochem (MWF 9:00 AM) I was like a teenager on the phone with their first crush: sitting in the back, kicking my feet, smiling and blushing trying to hide my excitement. I have ALWAYS wanted to take a biochem class. I might seriously take 5.13⁠02 Organic Chemistry II just so I can take 5.08,⁠03 Biochem II depending on how this class goes. It almost feels dissociative to be in this class. I feel like biochem has a lot of topics that we go our whole lives, in and out of the classroom, vaguely knowing that they happen but never really understanding step-by-step. Like babies know they’re alive, kids know we have cells, high schoolers know we metabolize, but no one really knows what is actually going on. To actually be in the class knowing that in like 7th grade I was sitting there thinking “This will all make sense one day” is trippppppy. Judging the syllabus though it’s gonna be pretty lethal… 5.601 – Thermodynamics I (MWF 10:00 AM) I have a love-hate relationship with the little thermodynamics that I know. In high school chem and 5.111,⁠04 gen chem, or officially Principles of Chemical Science I did very well in the thermodynamics units, always finding the work to be fairly easy and not painful to do. Having to sit down and listen to thermodynamics, though, does fill me with enough boredom to tranquilize a horse, or like, Godzilla. I’ll do the pset I’ll learn the topic whatever whatever, but today was just like defining temperature and pressure. Praying we get past PV=nRT in the first week. 18.03 – Differential Equations (MWF 1:00 PM) Long story short I was gonna ASE this class and then missed the sign-up deadline, so I lowkey know the first half of the class, and the second half I’ve heard is harder but very very doable. Most people at MIT take this class anyway, so I have no abundance of people to help me. The professor is a very fun and energetic Russian guy, but he was just reading the lecture notes word for word and maybe adding an example here and there. If it doesn’t get more useful it might be an “Aiden goes to lecture when he doesn’t already know a topic” kinda class. 10.10 – Introduction to Chemical Engineering (MWF 2:00 PM) Every single sophomore who declared 10/10B/10ENG has to take this class right now, so it’s just 44 of us in a room, fresh-faced and wide-eyed trying to figure out basic ChemE. It gives a strong sense of community among us since we’re all sitting in there at the same time, so super cute. On the other hand, the professors and peers described the class as very very challenging. They are either: Trying to hype themselves up and in reality the class is just fine I won’t make it past October Time will tell! 11.041 – Introduction to Housing, Community, and Economic Development (TR 9:30 AM) This is the only class I didn’t have today, so this one will have to remain a mystery in the public eye for now. When I read through all the HASS classes to pick one, this was at the top of my list because: It is so societally and politically important. It is something I could never learn to the same extent on my own outside of an academic environment, full of professionals and hand-selected literature to teach me (whereas I feel some HASS classes are things I could learn/do on my own time without much penalty). It is a 1.5 hour discussion-based class, which means lots and lots of readings!! The final project is to design your own city and ",1,https://mitadmissions.org/blogs/entry/getting-back-in-the-groove/
albums i like and why i like them by Kayode D. '27,N/A,0,"September 8, 2025","Home Blogs albums i like and why i like them by Kayode D. '27 pov: i ramble about music and won't shut up September 8, 2025 in Uncategorized I like music. A lot. And I like telling other people about the music that I like. I message my friends fairly often asking if they’ve listened to [insert mildly obscure musician here], and their random album from 2018. I keep having new ones, and I want some way to document why I like the albums that I like. So here is a list of cool musical projects⁠01 Caleb M. 27 complains that people will call it anything but an album. 'LP, project, record, JUST SAY ALBUM' that I like and why I like them. Imagine we’re walking through Newbury Comics, and I see this record, run over to you, and being to yap about why i like it: Beat The Champ [2015] – The Mountain Goats I’m not sure how I found this album, but I love it. It’s like the 5th album put out by The Mountain Goats, and it’s a concept album about Chavo Guerrero, a WWE lucha wrestler that the singer (and presumed protagonist of the album) watched as a kid in Texas. The album follows the boy as he grows up watching Chavo, and the path that Chavo had to walk in his life as a wrestler. I went down a wikipedia rabbit hole one day, so this might all be wrong but this is what I remember: The creator of this album, John Darnielle, didn’t have many good memories with his step father. One point of contact between the two was professional wrestling. The two would frequently go to watch the local circuit of obscure wrestlers where John’s stepdad, Mike, would sometimes be the only person cheering for the heel, or villain. In his preteen years, John became obsessed with wrestling and watched twice a week on a black and white TV. He always rooted for the hero, and whenever they threw out the rulebook against the heel to fight fire with fire, it would ignite something primal in him. His favorite wrestler was Chavo Guerrero Sr. Chavo Guerrero was born the son of Gordy Guerrero, an early pioneer of the Mexican Lucha Libre fighting circuit. The Guerreros had a wrestling ring in their backyard, and Chavo would practice wrestling with his uncle of a similar age, Eddie Guerrero. The two would grow up and join wrestling circuits, eventually making it to WWE. Eddie was known to be a “cheater” in the ring, and would try to get Chavo to fight dirty as well, although Chavo resisted. The two fought in tag team matches and individually, seeing a moderate amount of success, before the Hair Match (climax of the album), in which Chavo took on Eddie, and the loser got their head of long hair shaved by the victor. Eddie passed away on November 13, 2005, and Chavo continued to wrestle in Eddie’s honor. The album shifts from peppy and “wrestlemania!”-esque into a more somber tone, and I think this album hits especially hard when you know the full story. It makes the final track, Hair Match, even more resonant. Thank you Bry for getting me the physical CD of this album for my birthday. Fav. Tracks: Choked Out, Luna The Only Members That Show Up [2018] – Tomtsu This album is amazing. Tomtsu was active from 2018 – 2021, and was based out of Boston. I know, like, 3 Boston Bands and this is one of them. This is an album of complex guitar riffs and absolutely KILLER drum rhythms. I would describe it as “asymmetric” in the best way possible. They have this one song called “This Is Milk” off of their 2021 EP “the last tsupper” where they end with a syncopated 4/4 guitar riff and a non-linear, distinctly NON-4/4 drum solo over it. And this album, their self-titled freshman album, is the beginning of their grungy-nerdy-math rocky-asymmetrical musical sound. And they were in high school when they made this album. HIGH SCHOOL. Puts me to shame. They also have a youtube channel where they recorded a ton of their live shows so you can literally watch the band grow over the years. Fav. Tracks: Tongue Tied, Marmalade The Masquerade [2019] – mxmtoon I listened to mxmtoon for the first time like a week⁠02 a year and a week atp. this blog was basically finished but i lacked the Courage to Change and finish it ago, and this album, The Masquerade, is SO GOOOOD. It’s her first full album, and was released after her senior year of high school. It features the song “prom dress,” which went viral on tiktok in 2018. The album is a big collection of love songs, and it opens with some bangers. Unspoken Words, Prom Dress, Blame Game – a lot of bops. But the most important song in the entire album⁠03 and the turning point is the 6th track, my ted talk. In this song, mxmtoon reveals that she’s never been in love before. She explains that she writes these songs as if she’s an expert, but she’s only fooling herself. I think this singlehandedly makes the album at least 11 times better. Now, not only can you relate to the love songs if you have been in love, but if you haven’t been in love, you can relate to mxmtoon on an even deeper level because you too want these things you don’t really know",2,https://mitadmissions.org/blogs/entry/albums-i-like-and-why-i-like-them/
September Equinox Appreciation by Victor D. '27,N/A,0,"September 22, 2025","Home Blogs September Equinox Appreciation by Victor D. '27 A Cambridge Autumn September 22, 2025 in MIT Life Two years ago in freshman year (:O so long ago), I wrote this poem. I had just moved to Cambridge not even 3 months before, and was adjusting to a place radically different from home. In these first few months, I spent a lot of time walking and riding my bike, exploring Cambridge and Greater Boston. I don’t think much has changed about how amazing fall is to me and I’m looking forward to experience it all over again! This post commemorates the Autumn Equinox (which will occur almost exactly when this blog is posted on Monday, September 22nd, 2025 at 2:19 PM Eastern Time). A Cambridge Autumn Red, orange, yellow Red, orange, yellow Once green, now illuminate like fire. The forest transcends mere vegetation And becomes a sea of lava. The wind howls and whispers throughout the night Its haunting song implores me: “Look up from your desk! And out the window to the buildings across the field that glow and gleam like galaxies.” The stars of night are barely visible; city light trumps their radiance The buildings appear twice: once in substance, once in mirror The glassy surface of the river reflects a portal to another world A fabled cosmos brews in the water. Several nights now, I have gone to sleep with a gentle tap on my window As the rain downpours and downpours and downpours And the streets begin turning into channels. Which makes for a fun game on my bike, as I dash between puddles. Other times I’ve found myself caught in the rain Which unfortunately doesn’t understand boundaries But nevertheless I relish feeling it’s cool and gentle touch on my skin As much as I detest when it drenches my socks and shoes. Sometimes I stroll through the neighborhoods Beautiful New England Homes, a hodgepodge of color and character Some homes are amber, others cyan, or even a rich mahogany. Their chromatic dance with the autumnal trees rivals the Impressionist Greats. Thus, I once rode my bike to the Square. And decided to walk the rest of the way, to see the homes and streets lined in the oceans of Fall. Pigeons cooed, winds gushed, but together harmonized a gentle symphony. Porchsitters too waved gleefully, and I smiled and gestured back. Some say the Heavens weep when it rains: “Why did you walk here?” “Because the neighborhoods here are really pretty!” “But the weather is so bad today!” “What do you mean?” “Because there’s no sun; the sky is gray. It was raining” Because it was gray! There was no sun! It was raining! Therefore, it must be miserable. Therefore it must be miserable!? Perhaps it is naivety on my part, as it is seldom gray at home Or simply the honeymoon phase of my arrival here But I simply can’t help but wonder What is poetically miserable, and what is actually miserable. What is actually miserable? Certainly not Cambridge Autumn. November 5th, 2023 My first vivid recollection of Cambridge’s autumn comes from a bike ride in early October when I visited Ebisuya, a former Japanese grocery market in Medford.⁠01 sadly, it closed earlier this year :( As I descended through various neighborhoods of Medford, Sommerville, and Cambridge, the trees and their colorful leaves felt as though they were enveloping me as they blurred along the edges of my peripheral vision. This was my first time ever living through a stereotypical autumn, common in media though almost completely foreign to where I’m from. Here’s some pics I’ve taken of autumn throughout the years in various places in Greater Boston: Killian Court, Cambridge 08/22/2023 Beacon Street, Back Bay (Boston) 08/25/2024 Galaxy Park, Kendall Square (Cambridge) 08/28/2023 Emerald Necklace, Brookline 08/27/2023 An arrow pointing right Previous An arrow pointing right Next And here’s an example of the New England homes I referred to: the ubiquitous triple-decker.⁠02 Three-deckers (triple-deckers) are primarily found in New England, mostly constructed during suburban expansion in the first half the 20th century. i think they're pretty neat. Row of triple-deckers in Worcester, Massachusetts. Where I’m from in Camarillo, California, we have a dry season, a wet season, and interspersed other seasonal periods, like the Santa Ana Winds from the desert and “June Gloom” from the sea. Cambridge is obviously very different but, as you might infer, I’ve enjoyed it a lot (especially the rain)! (I’m foreshadowing more nature/season appreciation posts; my snow pictures lie in wait…) Post Tagged #autumn sadly, it closed earlier this year :(⁠ back to text ↑ Three-deckers (triple-deckers) are primarily found in New England, mostly constructed during suburban expansion in the first half the 20th century. i think they're pretty neat.⁠ back to text ↑ Share this post Share on Twitter Share on Reddit Share on Facebook Share by Email Subscribe to the RSS Feed Please enable JavaScript to view the comments powered by Disqus. About Victor D. '27 I'm Victor! I’m a ‘27 living on Putz in E",6,https://mitadmissions.org/blogs/entry/september-equinox-appreciation/
cookies by Aiden H. '28,N/A,0,"September 13, 2025","Home Blogs cookies by Aiden H. '28 life lessons through six scrumptious sayings September 13, 2025 in Challenges, How to Human, Miscellaneous Call it big-boned or call it taste, but I’ve always loved cookies.⁠01 ice cream is so meh why wouldn't you eat a cookie instead?? I grew up as a massive baker, and every December I take it as a mission to bake as many cookies as possible and hand them out to people I know–meaning keeping a gallon-sized Ziploc of cookies in my middle school backpack, slipping them under the desk to friends during class. So the other night, on another casual thought spiral about the innumerable delights of cookies, I realized how many idioms about cookies there are, if not the most of any dessert. I count six for cookies, four for cake,⁠02 The icing on the cake, the cake is a lie, to take the cake, and cakewalk one for pie,⁠03 Humble pie and zero for ice cream.⁠04 Aiden: 2 Ice Cream: 0 There can only be one anthropological and etymological answer: cookies are a foundational part of human nature, and their significance is represented in our phrases. Because of this, I’ve been thinking a lot about what cookies could mean to me and MIT culture, and how all the phrases work together. *** Smart cookie (or, doing well) So you grow up “gifted and talented” or whatever. But this is almost definitely a reflection of sociocultural factors and your willingness to be quiet as a child and not your passion about math or whatever. But you enjoy it, but who wouldn’t? Things are easy for a long time, and you don’t walk around telling everyone about how “great” you are, but adults will tell you and eventually you believe it just a little. Eventually you do have to start making a choice, and you make a good one–to try. You actually can be interested in the things you’re doing, and past the expectations of what you should be doing, you do it anyway because a part of you just likes it and it helps you in the long run. Everything is sweet. If you give a mouse a cookie (or, getting addicted to success) Soon you’re not so special, and that’s fine because that’s being a person, but so far your only thing has been being special, so who are you? You’re a person who clings to it. You try even harder. It’s an easy spiral to go down, and one you get tunnel-visioned into every couple weeks without realizing it. If you give a mouse a cookie, it might be able to recognize itself quickly as a junk-food junkie. But if you give a mouse a cookie and then surround it with other cracked-out mice running in circles and snorting chocolate chips, the mouse is gonna think they’re pretty well off. They have “balance” compared to the other mice. And then you snap out of it as soon as you get a little burnt out and remember that nothing is ever that deep that you need to major in finance or understand what YC does.⁠05 I genuinely didn't learn about what it stood for or what they do until last night when HackMIT kids told me You feel trapped in the bubble of it all though, you know? Accept all cookies (or, how much of yourself to give away) You gave your life away to work at age 15, and you’re already pretty tired. You would rather be doing a lot of other things that most teenagers probably would. But now it feels all you have to look forward to is work, because you spent the fun part of life working, and you can’t realistically spend the work part of life just messing around. Adults tell you all the time to enjoy the now, that soon all you’ll have to do is worry about work and bills, which feels ridiculous, because all you do and all you feel you’ve ever done is worry about work. But then every couple days in class, your professors talk about how you’re going to use something in the real workforce one day, and you remember that this whole thing so far hasn’t even been work, it’s literally just been the training. This is still the training? You debate about if you’re committing too much, because on the surface everyone talks about work-life balance, but secretly you know that you still have to be successful on paper to get everything you want. But now what you want is to be successful on paper, so everything is getting hazy. You remember a triangle you saw once: It’s an oversimplification, sure, but you’re also able to trace back everyone’s life ever to the triangle, so you buy into it. You know exactly which one you’ve always given up. Hand in the cookie jar (or, humility) So you realize it’s pretty bad because even your Spotify Daylist is starting to call you out.⁠06 angry crash-out anxiety tuesday evening What do you do when you’re caught red-handed in an emotional nightmare? You project it onto others, duh! You remind yourself that you could have it so much worse and you give advice to others about how to fix their own problems, because if you can subconsciously convince yourself that you’re doing better than others, then that means you’re probably just whining about your problems and they’re not real. And then someone gives you",4,https://mitadmissions.org/blogs/entry/cookies/
